<?xml version="1.0"?>
<!DOCTYPE PropertySetDef SYSTEM "PSD_R2x.dtd">
<?xml-stylesheet type="text/xsl" href="PSD_R2x.xsl"?>
<PropertySetDef>
  <IfcVersion version="2.x" schema="IfcSharedBldgServiceElements"/>
  <Name>Pset_PipeFitting</Name>
  <Definition>Definition from IAI: This property set is used to define the characteristics of a pipe fitting. Related property sets include Pset_PipeDesignCriteria.

HISTORY: New property set in IFC Release 2.0.

ISSUES: No issues to date.</Definition>
  <Typed>True</Typed>
  <TypedClass>IfcFlowFitting</TypedClass>
  <TypeName>PipeFitting</TypeName>
  <PropertyDefs>
    <PropertyDef id="573">
      <Name>FittingSubTypeEnum</Name>
      <PropertyType>
        <TypePropertyEnumeratedValue>
          <EnumList name="Pset_PipeFittingSubtypeEnum">
            <EnumItem>45DegreeElbow</EnumItem>
            <EnumItem>90DegreeElbow</EnumItem>
            <EnumItem>Cap</EnumItem>
            <EnumItem>Cock</EnumItem>
            <EnumItem>Crossover</EnumItem>
            <EnumItem>DoubleBranchElbow</EnumItem>
            <EnumItem>Flange</EnumItem>
            <EnumItem>Lateral</EnumItem>
            <EnumItem>PipeJoint</EnumItem>
            <EnumItem>Plug</EnumItem>
            <EnumItem>Reducer</EnumItem>
            <EnumItem>ReducingElbow</EnumItem>
            <EnumItem>Sleeve</EnumItem>
            <EnumItem>StreetElbow</EnumItem>
            <EnumItem>Tee</EnumItem>
            <EnumItem>Union</EnumItem>
            <EnumItem>Other</EnumItem>
            <EnumItem>NotKnown</EnumItem>
            <EnumItem>Unset</EnumItem>
          </EnumList>
        </TypePropertyEnumeratedValue>
      </PropertyType>
      <ValueDef>
        <MinValue value=""/>
        <MaxValue value=""/>
        <DefaultValue value=""/>
      </ValueDef>
      <Definition>
This enumeration identifies the fitting subtype.
      </Definition>
    </PropertyDef>

  </PropertyDefs>
</PropertySetDef>