<?xml version="1.0"?>
<!DOCTYPE PropertySetDef SYSTEM "PSD_R2x.dtd">
<?xml-stylesheet type="text/xsl" href="PSD_R2x.xsl"?>
<PropertySetDef>
  <IfcVersion version="2.x" schema="IfcHvacDomain"/>
  <Name>Pset_BinaryOutput</Name>
  <Definition>Definition from IAI: This property set is used to define the characteristics of a binary output.

HISTORY: New property set in IFC Release 2.0.

ISSUES: No issues to date.</Definition>
  <Typed>False</Typed>
  <TypedClass></TypedClass>
  <TypeName></TypeName>
  <PropertyDefs>
    <PropertyDef id="110">
      <Name>PolarityEnum</Name>
      <PropertyType>
        <TypePropertyEnumeratedValue>
          <EnumList name="Pset_PolarityEnum">
            <EnumItem>Normal</EnumItem>
            <EnumItem>Reverse</EnumItem>
            <EnumItem>Other</EnumItem>
            <EnumItem>NotKnown</EnumItem>
            <EnumItem>Unset</EnumItem>
          </EnumList>
        </TypePropertyEnumeratedValue>
      </PropertyType>
      <ValueDef>
        <MinValue value=""/>
        <MaxValue value=""/>
        <DefaultValue value=""/>
      </ValueDef>
      <Definition>
Enumeration defining the polarity
      </Definition>
    </PropertyDef>

    <PropertyDef id="111">
      <Name>InactiveText</Name>
      <PropertyType>
        <TypePropertySingleValue>
          <DataType type="IfcString"/>
        </TypePropertySingleValue>
      </PropertyType>
      <ValueDef>
        <MinValue value="see type"/>
        <MaxValue value="see type"/>
        <DefaultValue value="empty string"/>
      </ValueDef>
      <Definition>
String value to be displayed in an inactive, off, or idle state
      </Definition>
    </PropertyDef>

    <PropertyDef id="112">
      <Name>ActiveText</Name>
      <PropertyType>
        <TypePropertySingleValue>
          <DataType type="IfcString"/>
        </TypePropertySingleValue>
      </PropertyType>
      <ValueDef>
        <MinValue value="see type"/>
        <MaxValue value="see type"/>
        <DefaultValue value="empty string"/>
      </ValueDef>
      <Definition>
String value to be displayed in an active, on, or running state
      </Definition>
    </PropertyDef>

    <PropertyDef id="119">
      <Name>MinimumOffTime</Name>
      <PropertyType>
        <TypePropertyReferenceValue reftype="IfcLocalTime"/>
      </PropertyType>
      <ValueDef>
        <MinValue value="see type"/>
        <MaxValue value="see type"/>
        <DefaultValue value="NIL"/>
      </ValueDef>
      <Definition>
Minimum Off Time
      </Definition>
    </PropertyDef>

    <PropertyDef id="120">
      <Name>MinimumOnTime</Name>
      <PropertyType>
        <TypePropertyReferenceValue reftype="IfcLocalTime"/>
      </PropertyType>
      <ValueDef>
        <MinValue value="see type"/>
        <MaxValue value="see type"/>
        <DefaultValue value="NIL"/>
      </ValueDef>
      <Definition>
Minimum On Time
      </Definition>
    </PropertyDef>

    <PropertyDef id="121">
      <Name>FeedbackValueEnum</Name>
      <PropertyType>
        <TypePropertyEnumeratedValue>
          <EnumList name="Pset_FeedbackValueEnum">
            <EnumItem>Inactive</EnumItem>
            <EnumItem>Active</EnumItem>
            <EnumItem>Other</EnumItem>
            <EnumItem>NotKnown</EnumItem>
            <EnumItem>Unset</EnumItem>
          </EnumList>
        </TypePropertyEnumeratedValue>
      </PropertyType>
      <ValueDef>
        <MinValue value=""/>
        <MaxValue value=""/>
        <DefaultValue value=""/>
      </ValueDef>
      <Definition>
Enumeration defining the feedback value from the control system element
      </Definition>
    </PropertyDef>

    <PropertyDef id="77">
      <Name>EventEnableEnum</Name>
      <PropertyType>
        <TypePropertyEnumeratedValue>
          <EnumList name="Pset_EventEnableEnum">
            <EnumItem>To-OffNormal</EnumItem>
            <EnumItem>To-Fault</EnumItem>
            <EnumItem>To-Normal</EnumItem>
            <EnumItem>Other</EnumItem>
            <EnumItem>NotKnown</EnumItem>
            <EnumItem>Unset</EnumItem>
          </EnumList>
        </TypePropertyEnumeratedValue>
      </PropertyType>
      <ValueDef>
        <MinValue value=""/>
        <MaxValue value=""/>
        <DefaultValue value=""/>
      </ValueDef>
      <Definition>
Enumeration that defines the type of event enabling
      </Definition>
    </PropertyDef>

    <PropertyDef id="115">
      <Name>AckedTransitionsEnum</Name>
      <PropertyType>
        <TypePropertyEnumeratedValue>
          <EnumList name="Pset_AckedTransitionsEnum">
            <EnumItem>To-OffNormal</EnumItem>
            <EnumItem>To-Fault</EnumItem>
            <EnumItem>To-Normal</EnumItem>
            <EnumItem>Other</EnumItem>
            <EnumItem>NotKnown</EnumItem>
            <EnumItem>Unset</EnumItem>
          </EnumList>
        </TypePropertyEnumeratedValue>
      </PropertyType>
      <ValueDef>
        <MinValue value=""/>
        <MaxValue value=""/>
        <DefaultValue value=""/>
      </ValueDef>
      <Definition>
Enumeration that defines the type of transition acknowledgement
      </Definition>
    </PropertyDef>

  </PropertyDefs>
</PropertySetDef>